{
  "schemaVersion": "1.0.0",
  "fixtureId": "FIXTURE-003",
  "measurementFile": "measurement-synthetic-003-single-door.json",
  "expectedGeometry": {
    "boundaryVertexCount": 4,
    "wallCount": 4,
    "winding": "counterclockwise",
    "areaMm2": 4320000,
    "perimeterMm": 8400,
    "coordinateToleranceMm": 1,
    "angularToleranceDeg": 0.5
  },
  "expectedTopology": {
    "openingCount": 1,
    "doorCount": 1,
    "windowCount": 0,
    "drainagePointCount": 0,
    "pipeEnclosureCount": 0,
    "waterSupplyPointCount": 0,
    "openingWallIndexes": [2]
  }
}
