{
  "schemaVersion": "1.0.0",
  "fixtureId": "FIXTURE-002",
  "measurementFile": "measurement-synthetic-002-near-rectangle.json",
  "expectedGeometry": {
    "boundaryVertexCount": 4,
    "wallCount": 4,
    "winding": "counterclockwise",
    "areaMm2": 4290656,
    "perimeterMm": 8372.05,
    "coordinateToleranceMm": 1,
    "angularToleranceDeg": 0.5
  },
  "expectedTopology": {
    "openingCount": 0,
    "doorCount": 0,
    "windowCount": 0,
    "drainagePointCount": 0,
    "pipeEnclosureCount": 0,
    "waterSupplyPointCount": 0,
    "openingWallIndexes": []
  }
}
